{
  "provider": "qwen",
  "scenario": "success-text",
  "outputFormat": "text",
  "capturedAt": "2025-12-17T10:00:00Z",
  "cliVersion": "1.0.0",
  "rawOutput": {
    "stdout": "Hello! I'm Qwen, an AI assistant created by Alibaba Cloud. How can I assist you today?",
    "stderr": "",
    "exitCode": 0
  },
  "expected": {
    "content": "Hello! I'm Qwen, an AI assistant created by Alibaba Cloud. How can I assist you today?",
    "isError": false
  }
}
