{
  "provider": "grok",
  "scenario": "success-stream",
  "outputFormat": "stream-json",
  "capturedAt": "2025-12-17T10:00:00Z",
  "cliVersion": "1.0.0",
  "rawOutput": {
    "stdout": "{\"role\":\"user\",\"content\":\"Hello\"}\n{\"role\":\"assistant\",\"content\":\"Hey there! I'm Grok, built by xAI. What's on your mind?\"}",
    "stderr": "",
    "exitCode": 0
  },
  "expected": {
    "content": "Hey there! I'm Grok, built by xAI. What's on your mind?",
    "isError": false
  }
}
