{
  "provider": "glm",
  "scenario": "success-stream",
  "outputFormat": "stream-json",
  "capturedAt": "2025-12-17T10:00:00Z",
  "cliVersion": "1.0.0",
  "rawOutput": {
    "stdout": "{\"role\":\"user\",\"content\":\"Hello\"}\n{\"role\":\"assistant\",\"content\":\"Hello! I'm GLM, powered by Zhipu AI. How can I help you today?\"}",
    "stderr": "",
    "exitCode": 0
  },
  "expected": {
    "content": "Hello! I'm GLM, powered by Zhipu AI. How can I help you today?",
    "isError": false
  }
}
